<?xml version="1.0" encoding="UTF-8" ?>
<gems xmlns="http://sokolov.com/gem"
      xmlns:xsi="http://www.w3.org/2001/XMLSchema-instance"
      xsi:noNamespaceSchemaLocation="gemSchema.xsd">

    <gem id="id-1">
        <name>brilliant</name>
        <preciousness>precious</preciousness>
        <origin>Africa</origin>
        <visualParams>
            <color>white</color>
            <transparency>90</transparency>
            <numberOfFaces>12</numberOfFaces>
        </visualParams>
        <value>3</value>
    </gem>

    <gem id="id-2">
        <name>amethyst</name>
        <preciousness>semiprecious</preciousness>
        <origin>Russia</origin>
        <visualParams>
            <color>purple</color>
            <transparency>50</transparency>
            <numberOfFaces>5</numberOfFaces>
        </visualParams>
        <value>5</value>
    </gem>

</gems>